keyword,title,abstract,link,published,critical_category
Productivity,"Preparing spin-squeezed states in Rydberg atom arrays via quantum
  optimal control","We present a quantum optimal control protocol to generate highly
spin-squeezed states in Rydberg atom arrays coupled via Ising-type Van der
Waals interactions. Using gradient-based optimization techniques we construct
time-dependent pulse sequences that steer an initial product state toward
highly entangled, spin-squeezed states with predefined magnetization and
squeezing axes. We focus on the Wineland parameter $\xi_W^2$ to measure spin
squeezing and our approach achieves near-optimal spin squeezing in
one-dimensional ring arrays of up to $N=8$ spins, generating states with
entanglement depths exceeding 6, and significantly outperforming conventional
quench dynamics for all system sizes studied. Remarkably, optimized pulse
sequences can be directly scaled to larger arrays without additional
optimization, achieving a squeezing parameter as low as $\xi_W^2 = 0.227$ in
systems containing $N=50$ spins. This work demonstrates the potential of
quantum optimal control methods for preparing highly spin-squeezed states,
opening pathways to enhanced quantum metrology.",http://arxiv.org/abs/2507.07875v1,2025-07-10T15:59:13Z,General Tech & Society
Performance,"Impact of Pretraining Word Co-occurrence on Compositional Generalization
  in Multimodal Models","CLIP and large multimodal models (LMMs) have better accuracy on examples
involving concepts that are highly represented in the training data. However,
the role of concept combinations in the training data on compositional
generalization is largely unclear -- for instance, how does accuracy vary when
a common object appears in an uncommon pairing with another object? In this
paper, we investigate how word co-occurrence statistics in the pretraining
dataset (a proxy for co-occurrence of visual concepts) impacts CLIP/LMM
performance. To disentangle the effects of word co-occurrence frequencies from
single-word frequencies, we measure co-occurrence with pointwise mutual
information (PMI), which normalizes the joint probability of two words
co-occurring by the probability of co-occurring independently. Using
synthetically generated images with a variety of concept pairs, we show a
strong correlation between PMI in the CLIP pretraining data and zero-shot
accuracy in CLIP models trained on LAION-400M (r=0.97 and 14% accuracy gap
between images in the top and bottom 5% of PMI values), demonstrating that even
accuracy on common concepts is affected by the combination of concepts in the
image. Leveraging this finding, we reproduce this effect in natural images by
editing them to contain pairs with varying PMI, resulting in a correlation of
r=0.75. Finally, we demonstrate that this behavior in CLIP transfers to LMMs
built on top of CLIP (r=0.70 for TextVQA, r=0.62 for VQAv2). Our findings
highlight the need for algorithms and architectures that improve compositional
generalization in multimodal models without scaling the training data
combinatorially. Our code is available at
https://github.com/helenqu/multimodal-pretraining-pmi.",http://arxiv.org/abs/2507.08000v1,2025-07-10T17:59:59Z,General Tech & Society
Performance,PyVision: Agentic Vision with Dynamic Tooling,"LLMs are increasingly deployed as agents, systems capable of planning,
reasoning, and dynamically calling external tools. However, in visual
reasoning, prior approaches largely remain limited by predefined workflows and
static toolsets. In this report, we present PyVision, an interactive,
multi-turn framework that enables MLLMs to autonomously generate, execute, and
refine Python-based tools tailored to the task at hand, unlocking flexible and
interpretable problem-solving. We develop a taxonomy of the tools created by
PyVision and analyze their usage across a diverse set of benchmarks.
Quantitatively, PyVision achieves consistent performance gains, boosting
GPT-4.1 by +7.8% on V* and Claude-4.0-Sonnet by +31.1% on VLMsAreBlind-mini.
These results point to a broader shift: dynamic tooling allows models not just
to use tools, but to invent them, advancing toward more agentic visual
reasoning.",http://arxiv.org/abs/2507.07998v1,2025-07-10T17:59:55Z,General Tech & Society
Performance,"MGVQ: Could VQ-VAE Beat VAE? A Generalizable Tokenizer with Multi-group
  Quantization","Vector Quantized Variational Autoencoders (VQ-VAEs) are fundamental models
that compress continuous visual data into discrete tokens. Existing methods
have tried to improve the quantization strategy for better reconstruction
quality, however, there still exists a large gap between VQ-VAEs and VAEs. To
narrow this gap, we propose \NickName, a novel method to augment the
representation capability of discrete codebooks, facilitating easier
optimization for codebooks and minimizing information loss, thereby enhancing
reconstruction quality. Specifically, we propose to retain the latent dimension
to preserve encoded features and incorporate a set of sub-codebooks for
quantization. Furthermore, we construct comprehensive zero-shot benchmarks
featuring resolutions of 512p and 2k to evaluate the reconstruction performance
of existing methods rigorously. \NickName~achieves the \textbf{state-of-the-art
performance on both ImageNet and $8$ zero-shot benchmarks} across all VQ-VAEs.
Notably, compared with SD-VAE, we outperform them on ImageNet significantly,
with rFID $\textbf{0.49}$ v.s. $\textbf{0.91}$, and achieve superior PSNR on
all zero-shot benchmarks. These results highlight the superiority of
\NickName~in reconstruction and pave the way for preserving fidelity in HD
image processing tasks. Code will be publicly available at
https://github.com/MKJia/MGVQ.",http://arxiv.org/abs/2507.07997v1,2025-07-10T17:59:54Z,General Tech & Society
Performance,Single-pass Adaptive Image Tokenization for Minimum Program Search,"According to Algorithmic Information Theory (AIT) -- Intelligent
representations compress data into the shortest possible program that can
reconstruct its content, exhibiting low Kolmogorov Complexity (KC). In
contrast, most visual representation learning systems use fixed-length
representations for all inputs, ignoring variations in complexity or
familiarity. Recent adaptive tokenization methods address this by allocating
variable-length representations but typically require test-time search over
multiple encodings to find the most predictive one. Inspired by Kolmogorov
Complexity principles, we propose a single-pass adaptive tokenizer, KARL, which
predicts the appropriate number of tokens for an image in a single forward
pass, halting once its approximate KC is reached. The token count serves as a
proxy for the minimum description length. KARL's training procedure closely
resembles the Upside-Down Reinforcement Learning paradigm, as it learns to
conditionally predict token halting based on a desired reconstruction quality.
KARL matches the performance of recent adaptive tokenizers while operating in a
single pass. We present scaling laws for KARL, analyzing the role of
encoder/decoder size, continuous vs. discrete tokenization and more.
Additionally, we offer a conceptual study drawing an analogy between Adaptive
Image Tokenization and Algorithmic Information Theory, examining the predicted
image complexity (KC) across axes such as structure vs. noise and in- vs.
out-of-distribution familiarity -- revealing alignment with human intuition.",http://arxiv.org/abs/2507.07995v1,2025-07-10T17:59:53Z,AI Alignment & Cognitive Governance
Performance,Skip a Layer or Loop it? Test-Time Depth Adaptation of Pretrained LLMs,"Can a pretrained neural network adapt its architecture to different inputs
without any finetuning? Do we need all layers for simple tasks, and are they
adequate for challenging tasks? We found that the layers of a pretrained large
language model (LLM) can be manipulated as separate modules to build a better
and even shallower model customized for each test sample. In particular, each
layer from the pretrained model can be skipped/pruned or repeated multiple
times as recurrent neural networks (RNN), and stacked with others in arbitrary
orders, yielding a chain-of-layers (CoLa) per sample. This compositional space
greatly expands the scope of existing works on looped/recurrent pretrained
modules, layer pruning, or early-exit networks. We develop a Monte Carlo Tree
Search (MCTS) protocol to explore and identify the optimal CoLa for each sample
from math and commonsense reasoning benchmarks. Compared to a static model of a
fixed depth, CoLa allows shortcut paths (fast thinking), recurrence of the same
layer(s) (slow thinking), and combining both, offering more flexible, dynamic
architectures for different inputs. We conduct an extensive analysis of the
MCTS-optimized CoLa, which leads to two key findings: (1) For >75% of samples
with correct predictions by the original LLM, we can find shorter CoLa,
suggesting a large space for improving inference efficiency; (2) For >60% of
samples with originally incorrect predictions, we can identify CoLa achieving
correct predictions, suggesting a large space of performance enhancement. Our
results highlight the shortcomings of using a fixed architecture of pre-trained
LLMs for inference on different samples and pave the way to unlock the
generalization power of test-time depth adaptation.",http://arxiv.org/abs/2507.07996v1,2025-07-10T17:59:53Z,General Tech & Society
Success,Doodle Your Keypoints: Sketch-Based Few-Shot Keypoint Detection,"Keypoint detection, integral to modern machine perception, faces challenges
in few-shot learning, particularly when source data from the same distribution
as the query is unavailable. This gap is addressed by leveraging sketches, a
popular form of human expression, providing a source-free alternative. However,
challenges arise in mastering cross-modal embeddings and handling user-specific
sketch styles. Our proposed framework overcomes these hurdles with a
prototypical setup, combined with a grid-based locator and prototypical domain
adaptation. We also demonstrate success in few-shot convergence across novel
keypoints and classes through extensive experiments.",http://arxiv.org/abs/2507.07994v1,2025-07-10T17:59:49Z,General Tech & Society
Success,"Multimodal Framework for Explainable Autonomous Driving: Integrating
  Video, Sensor, and Textual Data for Enhanced Decision-Making and Transparency","Autonomous vehicles (AVs) are poised to redefine transportation by enhancing
road safety, minimizing human error, and optimizing traffic efficiency. The
success of AVs depends on their ability to interpret complex, dynamic
environments through diverse data sources, including video streams, sensor
measurements, and contextual textual information. However, seamlessly
integrating these multimodal inputs and ensuring transparency in AI-driven
decisions remain formidable challenges. This study introduces a novel
multimodal framework that synergistically combines video, sensor, and textual
data to predict driving actions while generating human-readable explanations,
fostering trust and regulatory compliance. By leveraging VideoMAE for
spatiotemporal video analysis, a custom sensor fusion module for real-time data
processing, and BERT for textual comprehension, our approach achieves robust
decision-making and interpretable outputs. Evaluated on the BDD-X (21113
samples) and nuScenes (1000 scenes) datasets, our model reduces training loss
from 5.7231 to 0.0187 over five epochs, attaining an action prediction accuracy
of 92.5% and a BLEU-4 score of 0.75 for explanation quality, outperforming
state-of-the-art methods. Ablation studies confirm the critical role of each
modality, while qualitative analyses and human evaluations highlight the
model's ability to produce contextually rich, user-friendly explanations. These
advancements underscore the transformative potential of multimodal integration
and explainability in building safe, transparent, and trustworthy AV systems,
paving the way for broader societal adoption of autonomous driving
technologies.",http://arxiv.org/abs/2507.07938v1,2025-07-10T17:21:35Z,General Tech & Society
Success,"Working with AI: Measuring the Occupational Implications of Generative
  AI","Given the rapid adoption of generative AI and its potential to impact a wide
range of tasks, understanding the effects of AI on the economy is one of
society's most important questions. In this work, we take a step toward that
goal by analyzing the work activities people do with AI, how successfully and
broadly those activities are done, and combine that with data on what
occupations do those activities. We analyze a dataset of 200k anonymized and
privacy-scrubbed conversations between users and Microsoft Bing Copilot, a
publicly available generative AI system. We find the most common work
activities people seek AI assistance for involve gathering information and
writing, while the most common activities that AI itself is performing are
providing information and assistance, writing, teaching, and advising.
Combining these activity classifications with measurements of task success and
scope of impact, we compute an AI applicability score for each occupation. We
find the highest AI applicability scores for knowledge work occupation groups
such as computer and mathematical, and office and administrative support, as
well as occupations such as sales whose work activities involve providing and
communicating information. Additionally, we characterize the types of work
activities performed most successfully, how wage and education correlate with
AI applicability, and how real-world usage compares to predictions of
occupational AI impact.",http://arxiv.org/abs/2507.07935v1,2025-07-10T17:16:33Z,General Tech & Society
Success,The maximum proportion of spreaders in stochastic rumor models,"We examine a general stochastic rumor model characterized by specific
parameters that govern the interaction rates among individuals. Our model
includes the \((\alpha, p)\)-probability variants of the well-known
Daley--Kendall and Maki--Thompson models. In these variants, a spreader
involved in an interaction attempts to transmit the rumor with probability
\(p\); if successful, any spreader encountering an individual already informed
of the rumor has probability \(\alpha\) of becoming a stifler. We prove that
the maximum proportion of spreaders throughout the process converges almost
surely, as the population size approaches~\(\infty\). For both the classical
Daley--Kendall and Maki--Thompson models, the asymptotic proportion of the
rumor peak is \(1 - \log 2 \approx 0.3069\).",http://arxiv.org/abs/2507.07914v1,2025-07-10T16:48:17Z,General Tech & Society
Success,"Mitigating Watermark Stealing Attacks in Generative Models via Multi-Key
  Watermarking","Watermarking offers a promising solution for GenAI providers to establish the
provenance of their generated content. A watermark is a hidden signal embedded
in the generated content, whose presence can later be verified using a secret
watermarking key. A threat to GenAI providers are \emph{watermark stealing}
attacks, where users forge a watermark into content that was \emph{not}
generated by the provider's models without access to the secret key, e.g., to
falsely accuse the provider. Stealing attacks collect \emph{harmless}
watermarked samples from the provider's model and aim to maximize the expected
success rate of generating \emph{harmful} watermarked samples. Our work focuses
on mitigating stealing attacks while treating the underlying watermark as a
black-box. Our contributions are: (i) Proposing a multi-key extension to
mitigate stealing attacks that can be applied post-hoc to any watermarking
method across any modality. (ii) We provide theoretical guarantees and
demonstrate empirically that our method makes forging substantially less
effective across multiple datasets, and (iii) we formally define the threat of
watermark forging as the task of generating harmful, watermarked content and
model this threat via security games.",http://arxiv.org/abs/2507.07871v1,2025-07-10T15:52:32Z,General Tech & Society
Social media,Improving the Price of Anarchy via Predictions in Parallel-Link Networks,"We study non-atomic congestion games on parallel-link networks with affine
cost functions. We investigate the power of machine-learned predictions in the
design of coordination mechanisms aimed at minimizing the impact of
selfishness. Our main results demonstrate that enhancing coordination
mechanisms with a simple advice on the input rate can optimize the social cost
whenever the advice is accurate (consistency), while only incurring minimal
losses even when the predictions are arbitrarily inaccurate (bounded
robustness). Moreover, we provide a full characterization of the consistent
mechanisms that holds for all monotone cost functions, and show that our
suggested mechanism is optimal with respect to the robustness. We further
explore the notion of smoothness within this context: we extend our mechanism
to achieve error-tolerance, i.e. we provide an approximation guarantee that
degrades smoothly as a function of the prediction error, up to a predetermined
threshold, while achieving a bounded robustness.",http://arxiv.org/abs/2507.07915v1,2025-07-10T16:49:33Z,General Tech & Society
Social media,"Conspiracy to Commit: Information Pollution, Artificial Intelligence,
  and Real-World Hate Crime","Is demand for conspiracy theories online linked to real-world hate crimes? By
analyzing online search trends for 36 racially and politically-charged
conspiracy theories in Michigan (2015-2019), we employ a one-dimensional
convolutional neural network (1D-CNN) to predict hate crime occurrences
offline. A subset of theories including the Rothschilds family, Q-Anon, and The
Great Replacement improves prediction accuracy, with effects emerging two to
three weeks after fluctuations in searches. However, most theories showed no
clear connection to offline hate crimes. Aligning with neutralization and
differential association theories, our findings provide a partial empirical
link between specific racially charged conspiracy theories and real-world
violence. Just as well, this study underscores the potential for machine
learning to be used in identifying harmful online patterns and advancing social
science research.",http://arxiv.org/abs/2507.07884v1,2025-07-10T16:06:13Z,General Tech & Society
Social media,"Credit Risk Analysis for SMEs Using Graph Neural Networks in Supply
  Chain","Small and Medium-sized Enterprises (SMEs) are vital to the modern economy,
yet their credit risk analysis often struggles with scarce data, especially for
online lenders lacking direct credit records. This paper introduces a Graph
Neural Network (GNN)-based framework, leveraging SME interactions from
transaction and social data to map spatial dependencies and predict loan
default risks. Tests on real-world datasets from Discover and Ant Credit (23.4M
nodes for supply chain analysis, 8.6M for default prediction) show the GNN
surpasses traditional and other GNN baselines, with AUCs of 0.995 and 0.701 for
supply chain mining and default prediction, respectively. It also helps
regulators model supply chain disruption impacts on banks, accurately
forecasting loan defaults from material shortages, and offers Federal Reserve
stress testers key data for CCAR risk buffers. This approach provides a
scalable, effective tool for assessing SME credit risk.",http://arxiv.org/abs/2507.07854v1,2025-07-10T15:33:53Z,General Tech & Society
Social media,"Modulation of PEDOT properties via cobalt ferrite nanoparticles:
  morphology, conjugation length, doping level, structure, and electrical
  conductivity","Composite materials based on Poly(3,4-ethylenedioxythiophene) (PEDOT) and
CoFe$_2$O$_4$ magnetic nanoparticles (NP) were synthesized by chemical
oxidative polymerization with varying monomer and surfactant (DBSA)
concentrations, and were compared to PEDOT samples synthesized without NP.
Electrical conductivity measurements were performed, which revealed that the
composites are more conductive than the pure PEDOT samples, with this effect
depending on EDOT and DBSA contents. Characterizations by SEM and TEM
microscopies, UV-Vis, FTIR and Raman spectroscopies, X-ray diffraction and
dynamic light scattering were carried out in order to associate the morphology
and structure of these materials to their electrical conductivity, and to
explain how EDOT and DBSA concentrations, and also the presence of NP, affects
those properties. It was found that the NP play a significant role in the
polymerization of EDOT, influencing the formation and arrangement of polymer
chains, as well as their conjugation length, oxidation state, and resonant
structures. These effects are also dependent on the DBSA content. To describe
the conductivity of the composites, a two-phase model based on general
effective media theory was introduced. The analysis revealed that, at low
reactant concentrations, the NP increase the conductivity of the adjacent PEDOT
by over two orders of magnitude.",http://arxiv.org/abs/2507.07849v1,2025-07-10T15:27:49Z,General Tech & Society
Social media,"DT4PCP: A Digital Twin Framework for Personalized Care Planning Applied
  to Type 2 Diabetes Management","Digital Twin (DT) technology has emerged as a transformative approach in
healthcare, but its application in personalized patient care remains limited.
This paper aims to present a practical implementation of DT in the management
of chronic diseases. We introduce a general DT framework for personalized care
planning (DT4PCP), with the core components being a real-time virtual
representation of a patient's health and emerging predictive models to enable
adaptive, personalized care. We implemented the DT4PCP framework for managing
Type 2 Diabetes (DT4PCP-T2D), enabling real-time collection of behavioral data
from patients with T2D, predicting emergency department (ED) risks, simulating
the effects of different interventions, and personalizing care strategies to
reduce ED visits. The DT4PCP-T2D also integrates social determinants of health
(SDoH) and other contextual data, offering a comprehensive view of the
patient's health to ensure that care recommendations are tailored to individual
needs. Through retrospective simulations, we demonstrate that integrating DTs
in T2D management can lead to significant advancements in personalized
medicine. This study underscores the potential of DT technology to
revolutionize chronic disease care.",http://arxiv.org/abs/2507.07809v1,2025-07-10T14:39:32Z,AI & Mental Health / Digital Twin
