keyword,title,abstract,link,published,critical_category
Stress,"Opting Out of Generative AI: a Behavioral Experiment on the Role of
  Education in Perplexity AI Avoidance","The rise of conversational AI (CAI), powered by large language models, is
transforming how individuals access and interact with digital information.
However, these tools may inadvertently amplify existing digital inequalities.
This study investigates whether differences in formal education are associated
with CAI avoidance, leveraging behavioral data from an online experiment (N =
1,636). Participants were randomly assigned to a control or an
information-seeking task, either a traditional online search or a CAI
(Perplexity AI). Task avoidance (operationalized as survey abandonment or
providing unrelated responses during task assignment) was significantly higher
in the CAI group (51%) compared to the search (30.9%) and control (16.8%)
groups, with the highest CAI avoidance among participants with lower education
levels (~74.4%). Structural equation modeling based on the theoretical
framework UTAUT2 and LASSO regressions reveal that education is strongly
associated with CAI avoidance, even after accounting for various cognitive and
affective predictors of technology adoption. These findings underscore
education's central role in shaping AI adoption and the role of self-selection
biases in AI-related research, stressing the need for inclusive design to
ensure equitable access to emerging technologies.",http://arxiv.org/abs/2507.07881v1,2025-07-10T16:05:11Z,AI Alignment & Cognitive Governance
Stress,"Membrane-mediated force transduction: Stick-slip motion of vesicles with
  fluid membranes","How internal forces are transduced into motion through soft, fluid membranes
remains a fundamental question in the study of active systems. To investigate
this coupling, we develop a minimal system consisting of a single ferromagnetic
particle encapsulated within a lipid vesicle with controlled membrane
composition and phase behavior. An external rotating magnetic field actuates
the particle, which rotates and translates along the inner membrane leaflet.
This motion generates local slip in the membrane; near a substrate, the slip
creates a shear gradient across the lubrication gap that propels the vesicle
forward. Propulsion is intermittent and strongest when the particle moves near
the vesicle bottom, where stress transmission is most effective. We find that
the coupling between internal flows and vesicle motion is highly sensitive to
membrane elasticity, excess area, and phase coexistence. Local membrane
deformation and flow dissipate part of the stress, limiting the efficiency of
force transduction. Additionally, membrane fluctuations and external boundaries
reduce particle mobility, and in phase-separated membranes, line tension at
domain boundaries deflects the particle and gradually reorients membrane
structure. These results demonstrate that lipid membranes not only transmit
internal stresses but also remodel themselves in response, actively shaping the
dynamics of force transduction and motion in active systems.",http://arxiv.org/abs/2507.07880v1,2025-07-10T16:04:29Z,General Tech & Society
Stress,"Homeostatic Adaptation of Optimal Population Codes under Metabolic
  Stress","Information processing in neural populations is inherently constrained by
metabolic resource limits and noise properties, with dynamics that are not
accurately described by existing mathematical models. Recent data, for example,
shows that neurons in mouse visual cortex go into a ""low power mode"" in which
they maintain firing rate homeostasis while expending less energy. This
adaptation leads to increased neuronal noise and tuning curve flattening in
response to metabolic stress. We have developed a theoretical population coding
framework that captures this behavior using two novel, surprisingly simple
constraints: an approximation of firing rate homeostasis and an energy limit
tied to noise levels via biophysical simulation. A key feature of our
contribution is an energy budget model directly connecting adenosine
triphosphate (ATP) use in cells to a fully explainable mathematical framework
that generalizes existing optimal population codes. Specifically, our
simulation provides an energy-dependent dispersed Poisson noise model, based on
the assumption that the cell will follow an optimal decay path to produce the
least-noisy spike rate that is possible at a given cellular energy budget. Each
state along this optimal path is associated with properties (resting potential
and leak conductance) which can be measured in electrophysiology experiments
and have been shown to change under prolonged caloric deprivation. We
analytically derive the optimal coding strategy for neurons under varying
energy budgets and coding goals, and show how our method uniquely captures how
populations of tuning curves adapt while maintaining homeostasis, as has been
observed empirically.",http://arxiv.org/abs/2507.07874v1,2025-07-10T15:58:57Z,AI Alignment & Cognitive Governance
Technostress,"AI-Driven Feedback Loops in Digital Technologies: Psychological Impacts
  on User Behaviour and Well-Being","The rapid spread of digital technologies has produced data-driven feedback
loops, wearable devices, social media networks, and mobile applications that
shape user behavior, motivation, and mental well-being. While these systems
encourage self-improvement and the development of healthier habits through
real-time feedback, they also create psychological risks such as technostress,
addiction, and loss of autonomy. The present study also aims to investigate the
positive and negative psychological consequences of feedback mechanisms on
users' behaviour and well-being. Employing a descriptive survey method, the
study collected data from 200 purposely selected users to assess changes in
behaviour, motivation, and mental well-being related to health, social, and
lifestyle applications. Results indicate that while feedback mechanisms
facilitate goal attainment and social interconnection through streaks and
badges, among other components, they also enhance anxiety, mental weariness,
and loss of productivity due to actions that are considered feedback-seeking.
Furthermore, test subjects reported that their actions are unconsciously shaped
by app feedback, often at the expense of personal autonomy, while real-time
feedback minimally influences professional or social interactions. The study
shows that data-driven feedback loops deliver not only motivational benefits
but also psychological challenges. To mitigate these risks, users should
establish boundaries regarding their use of technology to prevent burnout and
addiction, while developers need to refine feedback mechanisms to reduce
cognitive load and foster more inclusive participation. Future research should
focus on designing feedback mechanisms that promote well-being without
compromising individual freedom or increasing social comparison.",http://arxiv.org/abs/2411.09706v1,2024-10-30T17:11:30Z,Psychotechnologies & Behavioral Capture
Technostress,"Technostress and Resistance to Change in Maritime Digital
  Transformation: A Focused Review","The maritime industry is undergoing a significant digital transformation (DT)
to enhance efficiency and sustainability. This focused review investigates the
current state of literature on technostress and resistance to change among
seafarers as they adapt to new digital technologies. By critically reviewing a
focused selection of peer-reviewed articles, we identify the main themes and
trends within maritime research on DT. Findings indicate that while mental
health issues are a predominant concern, this is yet to also be investigated in
the context of new technology introduction in an industry that is already
setting seafarers under pressure. Additionally, change management is not
addressed, and DT is limited to specific functionalities rather than embracing
broad work practice transformations",http://arxiv.org/abs/2408.17408v1,2024-08-30T16:54:17Z,General Tech & Society
Technostress,"Spiritual Intelligence's Role in Reducing Technostress through Ethical
  Work Climates","This study explores the impact of spiritual intelligence (SI) on
technostress, with a focus on the mediating role of the ethical environment. In
an era where technological advancements continually reshape our work and
personal lives, understanding the interplay between human intelligence,
well-being, and ethics within organizations is increasingly significant.
Spiritual intelligence, transcending traditional cognitive and emotional
intelligences, emphasizes understanding personal meaning and values. This paper
investigates how higher levels of SI enable individuals to integrate technology
into their lives without undue stress, and how a robust ethical environment
within organizations supports and amplifies these benefits. Through a
comprehensive review of literature, empirical research, and detailed analysis,
the study highlights the protective role of SI against technostress and the
significant influence of an ethical climate in enhancing this effect. The
findings offer valuable insights for organizational strategies aimed at
promoting a harmonious, stress-free workplace environment.",http://arxiv.org/abs/2401.03658v1,2024-01-08T04:05:15Z,General Tech & Society
Technostress,"Technostress and Job Performance: Understanding the Negative Impacts and
  Strategic Responses in the Workplace","This study delves into the increasingly pertinent issue of technostress in
the workplace and its multifaceted impact on job performance. Technostress,
emerging from the rapid integration of technology in professional settings, is
identified as a significant stressor affecting employees across various
industries. The research primarily focuses on the ways in which technostress
influences job performance, both negatively and positively, depending on the
context and individual coping mechanisms. Through a blend of qualitative and
quantitative methodologies, including surveys and in-depth interviews, the
study examines the experiences of employees from diverse sectors. It highlights
how technostress manifests in different forms: from anxiety and frustration due
to constant connectivity to the pressure of adapting to new technologies. The
paper also explores the dual role of technology as both a facilitator and a
hindrance in the workplace.
  Significant findings indicate that technostress adversely impacts job
performance, leading to decreased productivity, diminished job satisfaction,
and increased turnover intentions. However, the study also uncovers that
strategic interventions, such as training programs, supportive leadership, and
fostering a positive technological culture, can mitigate these negative
effects. These interventions not only help in managing technostress but also in
harnessing the potential of technology for enhanced job performance.
  Furthermore, the research proposes a model outlining the relationship between
technostress, coping mechanisms, and job performance. This model serves as a
framework for organizations to understand and address the challenges posed by
technostress. The study concludes with recommendations for future research,
particularly in exploring the long-term effects of technostress and the
efficacy of various coping strategies.",http://arxiv.org/abs/2311.07072v1,2023-11-13T04:38:16Z,General Tech & Society
Technostress,"Examining the Influence of Job Satisfaction on Individual Innovation and
  Its Components: Considering the Moderating Role of Technostress","Background: Employee innovation is a crucial aspect of organizations in the
current era. Therefore, studying the factors influencing individual innovation
is vital and unavoidable. Undoubtedly, job satisfaction is a significant
variable in management sciences. Nowadays, all organizations are interconnected
with technology. Objective: This research explores the relationship between job
satisfaction and individual innovation, including its components, and the
moderating role of technostress. Research Method: This study, in terms of
purpose, is applied, and in terms of data collection method, it is a
descriptive survey. Data collection tools included the Technostress Inventory
by Tarafdar and colleagues (2007), Janssen's Individual Innovation
Questionnaire (2000), and the Job Satisfaction Survey (JSS) by Spector (1994).
The validity and reliability of these questionnaires were confirmed. The sample
size for this study was 215, and data analysis was performed using SPSS and
SMART-PLS software. Findings: Job satisfaction has a significant and positive
relationship with individual innovation, idea generation, idea promotion, and
idea implementation. Technostress moderates the relationship between job
satisfaction and individual innovation, as well as idea generation and idea
promotion. However, technostress does not play a moderating role in the
relationship between job satisfaction and idea implementation. Conclusion:
Based on the obtained results, organizations should take necessary measures to
increase job satisfaction and reduce technostress among their employees.",http://arxiv.org/abs/2310.13861v1,2023-10-20T23:53:36Z,General Tech & Society
Epigenetics,Hopfield Networks as Models of Emergent Function in Biology,"Hopfield models, originally developed to study memory retrieval in neural
networks, have become versatile tools for modeling diverse biological systems
in which function emerges from collective dynamics. In this review, we provide
a pedagogical introduction to both classical and modern Hopfield networks from
a biophysical perspective. After presenting the underlying mathematics, we
build physical intuition through three complementary interpretations of
Hopfield dynamics: as noise discrimination, as a geometric construction
defining a natural coordinate system in pattern space, and as gradient-like
descent on an energy landscape. We then survey recent applications of Hopfield
networks a variety of biological setting including cellular differentiation and
epigenetic memory, molecular self-assembly, and spatial neural representations.",http://arxiv.org/abs/2506.13076v1,2025-06-16T03:48:49Z,General Tech & Society
Epigenetics,"UniPTMs: The First Unified Multi-type PTM Site Prediction Model via
  Master-Slave Architecture-Based Multi-Stage Fusion Strategy and Hierarchical
  Contrastive Loss","As a core mechanism of epigenetic regulation in eukaryotes, protein
post-translational modifications (PTMs) require precise prediction to decipher
dynamic life activity networks. To address the limitations of existing deep
learning models in cross-modal feature fusion, domain generalization, and
architectural optimization, this study proposes UniPTMs: the first unified
framework for multi-type PTM prediction. The framework innovatively establishes
a ""Master-Slave"" dual-path collaborative architecture: The master path
dynamically integrates high-dimensional representations of protein sequences,
structures, and evolutionary information through a Bidirectional Gated
Cross-Attention (BGCA) module, while the slave path optimizes feature
discrepancies and recalibration between structural and traditional features
using a Low-Dimensional Fusion Network (LDFN). Complemented by a Multi-scale
Adaptive convolutional Pyramid (MACP) for capturing local feature patterns and
a Bidirectional Hierarchical Gated Fusion Network (BHGFN) enabling multi-level
feature integration across paths, the framework employs a Hierarchical Dynamic
Weighting Fusion (HDWF) mechanism to intelligently aggregate multimodal
features. Enhanced by a novel Hierarchical Contrastive loss function for
feature consistency optimization, UniPTMs demonstrates significant performance
improvements (3.2%-11.4% MCC and 4.2%-14.3% AP increases) over state-of-the-art
models across five modification types and transcends the Single-Type Prediction
Paradigm. To strike a balance between model complexity and performance, we have
also developed a lightweight variant named UniPTMs-mini.",http://arxiv.org/abs/2506.05443v1,2025-06-05T13:02:43Z,Psychotechnologies & Behavioral Capture
Epigenetics,ANT: Adaptive Neural Temporal-Aware Text-to-Motion Model,"While diffusion models advance text-to-motion generation, their static
semantic conditioning ignores temporal-frequency demands: early denoising
requires structural semantics for motion foundations while later stages need
localized details for text alignment. This mismatch mirrors biological
morphogenesis where developmental phases demand distinct genetic programs.
Inspired by epigenetic regulation governing morphological specialization, we
propose **(ANT)**, an **A**daptive **N**eural **T**emporal-Aware architecture.
ANT orchestrates semantic granularity through: **(i) Semantic Temporally
Adaptive (STA) Module:** Automatically partitions denoising into low-frequency
structural planning and high-frequency refinement via spectral analysis. **(ii)
Dynamic Classifier-Free Guidance scheduling (DCFG):** Adaptively adjusts
conditional to unconditional ratio enhancing efficiency while maintaining
fidelity. **(iii) Temporal-semantic reweighting:** Quantitatively aligns text
influence with phase requirements. Extensive experiments show that ANT can be
applied to various baselines, significantly improving model performance, and
achieving state-of-the-art semantic alignment on StableMoFusion.",http://arxiv.org/abs/2506.02452v1,2025-06-03T05:17:37Z,AI Alignment & Cognitive Governance
Epigenetics,A DNA Methylation Classification Model Predicts Organ and Disease Site,"Cell-free DNA (cfDNA) analysis is a powerful, minimally invasive tool for
monitoring disease progression, treatment response, and early detection. A
major challenge, however, is accurately determining the tissue of origin,
especially in complex or heterogeneous disease contexts. To address this, we
developed a machine learning framework that leverages tissue-specific DNA
methylation signatures to classify both tissue and disease origin from cfDNA
data. Our model integrates methylation datasets across diverse epigenomic
platforms, including Whole Genome Bisulfite Sequencing (WGBS), Illumina
Infinium Bead Arrays, and Enzymatic Methyl-seq (EM-seq). To account for
platform variability and data sparsity, we applied imputation strategies and
harmonized CpG features to enable cross-platform learning. Dimensionality
reduction revealed clear tissue-specific clustering of methylation profiles. A
random forest classifier trained on these features achieved consistent
classification performance (accuracy 0.75-0.8 across test sets and platforms).
Notably, our model distinguished clinically relevant tissues such as inflamed
synovium and peripheral blood mononuclear cells (PBMCs) in arthritis patients
and deconvoluted synthetic cfDNA mixtures mimicking real-world liquid biopsy
samples. The predicted tissue proportions closely matched the true values,
demonstrating the model's potential for both classification and quantitative
inference. These results support the feasibility of using cross-platform
methylation data and machine learning for scalable, generalizable cfDNA
diagnostics and lay the groundwork for future integration of disease-specific
epigenetic features to guide clinical decision-making in precision medicine.",http://arxiv.org/abs/2506.00146v1,2025-05-30T18:38:26Z,General Tech & Society
Epigenetics,"Intermediate State Formation of Topologically Associated Chromatin
  Domains using Quantum Annealing","Topologically Associating Chromatic Domains are spatially distinct chromatin
regions that regulate transcription by segregating active and inactive genomic
elements. Empirical studies show that their formation correlates with local
patterns of epigenetic markers, yet the precise mechanisms linking 1D
epigenetic landscapes to 3D chromatin folding remain unclear. Recent models
represent chromatin as a spin system, where nucleosomes are treated as
discrete-state variables coupled by interaction strengths derived from genomic
and epigenomic data. Classical samplers struggle with these models due to high
frustration and dense couplings. Here, we present a quantum annealing (QA)
approach to efficiently sample chromatin states, embedding an epigenetic Ising
model into the topology of D-Wave quantum processors.",http://arxiv.org/abs/2505.23289v1,2025-05-29T09:40:39Z,General Tech & Society
Productivity,Cohomology and Extensions of $C_p$-Green Functors of Lie Type,"We develop a theory of $C_p$-Green functors of Lie type, unifying the
axiomatic framework of Green functors with the structure of Lie algebras under
the action of a cyclic group $C_p$ of prime order. Extending classical notions
from representation theory and topology, we define tensor and exterior
products, introduce an equivariant Chevalley-Eilenberg cohomology, and
construct cup products that endow the cohomology with a graded Green functor of
Lie type structure. A key result establishes a correspondence between
equivalence classes of singular extensions and second cohomology groups,
generalizing classical Lie algebra extension theory to the equivariant setting.
This framework enriches the toolkit for studying equivariant algebraic
structures and paves the way for further applications in deformation theory,
homotopical algebra, and representation theory.",http://arxiv.org/abs/2507.07962v1,2025-07-10T17:41:56Z,General Tech & Society
Productivity,"The Trust Fabric: Decentralized Interoperability and Economic
  Coordination for the Agentic Web","The fragmentation of AI agent ecosystems has created urgent demands for
interoperability, trust, and economic coordination that current protocols --
including MCP (Hou et al., 2025), A2A (Habler et al., 2025), ACP (Liu et al.,
2025), and Cisco's AGP (Edwards, 2025) -- cannot address at scale. We present
the Nanda Unified Architecture, a decentralized framework built around three
core innovations: fast DID-based agent discovery through distributed
registries, semantic agent cards with verifiable credentials and composability
profiles, and a dynamic trust layer that integrates behavioral attestations
with policy compliance. The system introduces X42/H42 micropayments for
economic coordination and MAESTRO, a security framework incorporating
Synergetics' patented AgentTalk protocol (US Patent 12,244,584 B1) and secure
containerization. Real-world deployments demonstrate 99.9 percent compliance in
healthcare applications and substantial monthly transaction volumes with strong
privacy guarantees. By unifying MIT's trust research with production
deployments from Cisco and Synergetics, we show how cryptographic proofs and
policy-as-code transform agents into trust-anchored participants in a
decentralized economy (Lakshmanan, 2025; Sha, 2025). The result enables a
globally interoperable Internet of Agents where trust becomes the native
currency of collaboration across both enterprise and Web3 ecosystems.",http://arxiv.org/abs/2507.07901v1,2025-07-10T16:33:06Z,General Tech & Society
Productivity,The integro-differential closure of a commutative differential ring,"An integro-differential ring is a differential ring that is closed under an
integration operation satisfying the fundamental theorem of calculus. Via the
Newton--Leibniz formula, a generalized evaluation is defined in terms of
integration and differentiation. The induced evaluation is not necessarily
multiplicative, which allows to model functions with singularities and leads to
generalized shuffle relations. In general, not every element of a differential
ring has an antiderivative in the same ring. Starting from a commutative
differential ring and a direct decomposition into integrable and non-integrable
elements, we construct the free integro-differential ring. This
integro-differential closure contains all nested integrals over elements of the
original differential ring. We exhibit the relations satisfied by generalized
evaluations of products of nested integrals. Investigating these relations of
constants, we characterize in terms of Lyndon words certain evaluations of
products that determine all others. We also analyze the relation of the free
integro-differential ring with the shuffle algebra. To preserve integrals in
the original differential ring for computations in its integro-differential
closure, we introduce the notion of quasi-integro-differential rings and give
an adapted construction of the free integro-differential ring. Finally, in a
given integro-differential ring, we consider the internal integro-differential
closure of a differential subring and identify it as quotient of the free
integro-differential ring by certain constants.",http://arxiv.org/abs/2507.07889v1,2025-07-10T16:20:13Z,General Tech & Society
Productivity,Excess Observables Reveal Nonreciprocity in Integrated Covariance,"Near equilibrium, the symmetric part of the time-integrated steady-state
covariance, i.e., the time integral of correlation functions, is governed by
the fluctuation-dissipation theorem, while the antisymmetric part vanishes due
to Onsager reciprocity. Far from equilibrium, where these principles no longer
apply, we develop a unified formalism for both symmetric and antisymmetric
components of integrated covariances. We derive exact, computationally
tractable expressions for these quantities, valid in arbitrary nonequilibrium
steady states of Markov jump processes. Both components are expressed in terms
of excess observables, a notion central to both statistical physics and
reinforcement learning. Furthermore, we establish thermodynamic upper bounds
for these covariances in terms of entropy production, dynamical activity, and
cycle affinities.",http://arxiv.org/abs/2507.07876v1,2025-07-10T15:59:44Z,General Tech & Society
